{
  "schemaVersion": "jobatlas-first-run-pack-v1",
  "packId": "euraxess",
  "product": {
    "name": "EURAXESS Jobs Scraper",
    "outcome": "Inspect up to five recent postdoctoral machine-learning opportunities in Germany.",
    "websiteUrl": "https://jobatlas.dev/actors/euraxess"
  },
  "actor": {
    "slug": "euraxess-enrich-translate-normalize-scraper",
    "immutableActorId": "Slu3SAWULLRYnCN9Y",
    "storeUrl": "https://apify.com/jobatlas/euraxess-enrich-translate-normalize-scraper",
    "apiActorId": "jobatlas~euraxess-enrich-translate-normalize-scraper",
    "buildSelector": "latest",
    "datedPublicReadback": {
      "observedAt": "2026-09-11T01:13:07+02:00",
      "actorPublic": true,
      "actorDeprecated": false,
      "defaultBuildSelector": "latest",
      "buildNumber": "1.0.4",
      "buildId": "x0bGueGFnm6eEGY3K",
      "buildStatus": "SUCCEEDED",
      "pricingModel": "PAY_PER_EVENT",
      "primaryEventName": "result",
      "primaryUnitPriceUsd": 0.0009,
      "optionalEventPricesUsd": [
        {
          "eventName": "position-enrichment",
          "unitPriceUsd": 0.006
        },
        {
          "eventName": "position-enrichment-gold",
          "unitPriceUsd": 0.01
        },
        {
          "eventName": "translation",
          "unitPriceUsd": 0.006
        }
      ],
      "proofBoundary": "Public metadata and build state only; this read did not execute the Actor or prove source health, output, billing, or delivery."
    }
  },
  "starter": {
    "inputPath": "integrations/api/euraxess-search.json",
    "inputSha256": "1ef65e202ebee45f038d5cd6905d6b9a6ea1e7b5073ce4610fc0e63865c3f5c8",
    "maxItems": 5,
    "maxTotalChargeUsd": 0.05,
    "optionalPaidFeaturesDisabled": [
      "aiEnrichment",
      "translateToEnglish"
    ],
    "statefulFeaturesDisabled": [
      "dedupe",
      "analyticsEnabled"
    ]
  },
  "sample": {
    "recordPath": "website/samples/explorer/euraxess.json",
    "recordSha256": "8e37d43b9641740dbbad130ed58203267bb87594f8559333e6c42afc5e53ae06",
    "rowSchemaPath": "integrations/shared/nomad-agent-job-v1.schema.json",
    "rowSchemaSha256": "98f80ed31df9ae5ff7f4ebea97e2c6b5d835c1dcfcdfac54fec8e20b59ba3f4f",
    "rowSchemaVersion": "nomad-agent-job-v1",
    "sourceExtensionSchemaPath": "integrations/shared/euraxess-v1.schema.json",
    "sourceExtensionSchemaSha256": "ced8255f5950ba0e07bcdb9340b5202952b22044cb008e9462868b6665036956",
    "sourceExtensionSchemaVersion": "euraxess-v1",
    "sampleSource": "euraxess",
    "evidenceClass": "recorded_source_result",
    "observedAt": "2026-09-04T12:23:46.255387Z",
    "note": "Recorded source result observed on 4 September 2026. The source posting can expire; download it through this manifest so date, classification, and hash stay attached.",
    "notProofOf": [
      "current vacancy availability",
      "the exact proposed Actor run",
      "source-wide completeness",
      "a destination write"
    ]
  },
  "completion": {
    "runSummarySchemaPath": "integrations/shared/run-summary-v4.schema.json",
    "runSummarySchemaSha256": "3cdd430412bdd7fbbb864b1c92c91743d3577dcd1d0e6280b202d073287dec21",
    "runSummarySchemaVersion": "nomad-agent-run-summary-v4",
    "datasetCountField": "delivered",
    "usableSummaryStatuses": [
      "succeeded",
      "empty",
      "empty-limited",
      "partial"
    ],
    "requiredRunReceiptFields": [
      "id",
      "buildId",
      "buildNumber",
      "defaultDatasetId",
      "defaultKeyValueStoreId",
      "status",
      "exitCode"
    ],
    "sourceRule": "Every dataset row must validate as nomad-agent-job-v1, have identity.source=euraxess, and validate custom.data against euraxess-v1.",
    "retryRule": "Do not retry automatically. Record a partial summary's bounded recommendation and request separate approval before another paid run.",
    "costRule": "Read settled result and optional-event charges from the exact run. Five base rows at the observed unit price are $0.0045; $0.05 is a ceiling, not a quote or a promise of five rows."
  },
  "guidance": {
    "expectedOutput": "Zero to five canonical research-job rows with original source identity and published deadline, funding, contact, requirement, and location facts when available.",
    "unknownFields": "null means unknown or unavailable; [] means the source established an empty collection. Source taxonomy such as Positions is not an applicant education requirement.",
    "empty": "Accept zero rows only with a valid same-run summary. empty-limited means no rows within this run's limits and is not proof that no matching EURAXESS opportunity exists.",
    "partial": "A partial result can be useful. resultsLimited=true with no retry recommendation can simply reflect the five-row cap.",
    "failure": "Reject non-SUCCEEDED terminal runs, missing immutable build or storage identities, invalid summaries, source/custom-schema drift, or dataset-count mismatches.",
    "limitations": [
      "EURAXESS publication dates do not include an hour; date filters use inclusive UTC calendar dates.",
      "A recorded source row does not guarantee that its application remains open.",
      "Job Atlas is independently developed and is not an official European Commission or EURAXESS service."
    ],
    "supportUrl": "https://apify.com/jobatlas/euraxess-enrich-translate-normalize-scraper/issues",
    "supportedNextStep": "After validating the Actor result, use the maintained REST, MCP, n8n, Make, Python, or Agent Skill path; Airtable is a projection only.",
    "nextStepProof": "Repository assets are locally validated. Import, hosted-channel execution, scheduling, and named-destination delivery remain separate proof."
  },
  "relatedExecutionEvidence": {
    "observedAt": "2026-09-09",
    "runId": "0s3ZypkpzoncXvlyE",
    "resolvedBuildNumber": "1.0.4",
    "resolvedBuildId": "x0bGueGFnm6eEGY3K",
    "datasetRows": 2,
    "summaryStatus": "partial",
    "exactStarterInput": false,
    "destinationWrite": false,
    "evidenceClass": "related_current_organization_run",
    "note": "S03 retained a successful default-selector Job Atlas run with two usable rows. It did not use this exact input or prove a destination."
  },
  "approvalProposal": {
    "state": "not_run_requires_approval",
    "method": "apify_actor_api",
    "endpoint": "https://api.apify.com/v2/acts/jobatlas~euraxess-enrich-translate-normalize-scraper/runs",
    "buildSelector": "latest",
    "inputPath": "integrations/api/euraxess-search.json",
    "inputSha256": "1ef65e202ebee45f038d5cd6905d6b9a6ea1e7b5073ce4610fc0e63865c3f5c8",
    "maxItems": 5,
    "maxTotalChargeUsd": 0.05,
    "maxFollowUpRuns": 0,
    "checks": [
      "terminal_succeeded",
      "resolved_build_identity",
      "same_run_storages",
      "summary_schema",
      "summary_status",
      "dataset_count",
      "row_schema",
      "row_source",
      "retry_policy",
      "settled_cost"
    ],
    "sideEffects": [
      "One paid Actor run and retained Apify run, dataset, key-value-store, and accounting records.",
      "No destination, schedule, webhook, publication, or metadata change."
    ],
    "rollback": "Do not retry or publish the result. Preserve the failed receipt for diagnosis; no Actor selector or metadata is changed by this proposal."
  }
}
