{
  "schemaVersion": "jobatlas-first-run-pack-v1",
  "packId": "linkedin",
  "product": {
    "name": "LinkedIn Jobs Scraper",
    "outcome": "Inspect up to five recent TypeScript roles for a bounded Spain search.",
    "websiteUrl": "https://jobatlas.dev/actors/linkedin"
  },
  "actor": {
    "slug": "linkedin-enrich-translate-normalize-scraper",
    "immutableActorId": "KMflYVTHiIAXE6nKN",
    "storeUrl": "https://apify.com/jobatlas/linkedin-enrich-translate-normalize-scraper",
    "apiActorId": "jobatlas~linkedin-enrich-translate-normalize-scraper",
    "buildSelector": "latest",
    "datedPublicReadback": {
      "observedAt": "2026-09-11T01:13:07+02:00",
      "actorPublic": true,
      "actorDeprecated": false,
      "defaultBuildSelector": "latest",
      "buildNumber": "1.0.5",
      "buildId": "4wE4rKPq5aq7jeIY1",
      "buildStatus": "SUCCEEDED",
      "pricingModel": "PAY_PER_EVENT",
      "primaryEventName": "result",
      "primaryUnitPriceUsd": 0.0009,
      "optionalEventPricesUsd": [
        {
          "eventName": "position-enrichment",
          "unitPriceUsd": 0.004
        },
        {
          "eventName": "position-enrichment-gold",
          "unitPriceUsd": 0.01
        },
        {
          "eventName": "translation",
          "unitPriceUsd": 0.006
        }
      ],
      "proofBoundary": "Public metadata and build state only; this read did not execute the Actor or prove source health, output, billing, or delivery."
    }
  },
  "starter": {
    "inputPath": "integrations/api/linkedin-search.json",
    "inputSha256": "f5c2379ac95edd74fbc76f236cc23bb2cc02c998cdf69f76a2e6643fe4a767f0",
    "maxItems": 5,
    "maxTotalChargeUsd": 0.1,
    "optionalPaidFeaturesDisabled": [
      "firstRunMode",
      "aiEnrichment",
      "translateToEnglish",
      "companyProfileEnrichment"
    ],
    "statefulFeaturesDisabled": [
      "dedupe",
      "analyticsEnabled"
    ]
  },
  "sample": {
    "recordPath": "website/samples/explorer/linkedin.json",
    "recordSha256": "925c479fee8831b3efb9a82481484f21ac3add8dd5410e760b2bb026f11b9272",
    "rowSchemaPath": "integrations/shared/nomad-agent-job-v1.schema.json",
    "rowSchemaSha256": "98f80ed31df9ae5ff7f4ebea97e2c6b5d835c1dcfcdfac54fec8e20b59ba3f4f",
    "rowSchemaVersion": "nomad-agent-job-v1",
    "sourceExtensionSchemaPath": null,
    "sourceExtensionSchemaSha256": null,
    "sourceExtensionSchemaVersion": null,
    "sampleSource": "linkedin",
    "evidenceClass": "illustrative_fixture",
    "observedAt": null,
    "note": "Fictional schema example. Download it through this manifest so the illustrative provenance and record hash stay attached.",
    "notProofOf": [
      "a live vacancy",
      "an Actor run",
      "the current latest build output",
      "a destination write"
    ]
  },
  "completion": {
    "runSummarySchemaPath": "integrations/shared/run-summary-v4.schema.json",
    "runSummarySchemaSha256": "3cdd430412bdd7fbbb864b1c92c91743d3577dcd1d0e6280b202d073287dec21",
    "runSummarySchemaVersion": "nomad-agent-run-summary-v4",
    "datasetCountField": "delivered",
    "usableSummaryStatuses": [
      "succeeded",
      "empty",
      "empty-limited",
      "partial"
    ],
    "requiredRunReceiptFields": [
      "id",
      "buildId",
      "buildNumber",
      "defaultDatasetId",
      "defaultKeyValueStoreId",
      "status",
      "exitCode"
    ],
    "sourceRule": "Every dataset row must validate as nomad-agent-job-v1 and have identity.source=linkedin.",
    "retryRule": "Do not retry automatically. Record a partial summary's bounded recommendation and request separate approval before another paid run.",
    "costRule": "Read settled result and optional-event charges from the exact run. Five base rows at the observed unit price are $0.0045; $0.10 is a ceiling, not a quote or a promise of five rows."
  },
  "guidance": {
    "expectedOutput": "Zero to five canonical job rows with source identity, posting links when published, normalized facts, and explicit unknowns.",
    "unknownFields": "null means unknown or unavailable; [] means the source established an empty collection. A matching search filter does not make an unknown per-job fact true.",
    "empty": "Accept zero rows only with a valid same-run summary. It means no rows were delivered for this bounded input and observed source state, not that no matching jobs exist.",
    "partial": "A partial result can be useful. resultsLimited=true with no retry recommendation can simply reflect the five-row cap.",
    "failure": "Reject non-SUCCEEDED terminal runs, missing immutable build or storage identities, invalid summaries, source drift, schema errors, or dataset-count mismatches.",
    "limitations": [
      "Public LinkedIn availability and fields can change.",
      "The Actor is independently developed and is not affiliated with or endorsed by LinkedIn.",
      "Runtime varies with source state and selected options; a client timeout is not a runtime promise."
    ],
    "supportUrl": "https://apify.com/jobatlas/linkedin-enrich-translate-normalize-scraper/issues",
    "supportedNextStep": "After validating the Actor result, use the maintained REST, MCP, n8n, Make, Python, or Agent Skill path; Airtable is a projection only.",
    "nextStepProof": "Repository assets are locally validated. Import, hosted-channel execution, scheduling, and named-destination delivery remain separate proof."
  },
  "relatedExecutionEvidence": {
    "observedAt": "2026-09-09",
    "runId": "N8yk4dVkRSr1avM93",
    "resolvedBuildNumber": "1.0.5",
    "resolvedBuildId": "4wE4rKPq5aq7jeIY1",
    "datasetRows": 2,
    "summaryStatus": "partial",
    "exactStarterInput": false,
    "destinationWrite": false,
    "evidenceClass": "related_current_organization_run",
    "note": "S03 retained a successful default-selector Job Atlas run with two usable rows. It did not use this exact input, and its early charge receipt was not final billing proof."
  },
  "approvalProposal": {
    "state": "not_run_requires_approval",
    "method": "apify_actor_api",
    "endpoint": "https://api.apify.com/v2/acts/jobatlas~linkedin-enrich-translate-normalize-scraper/runs",
    "buildSelector": "latest",
    "inputPath": "integrations/api/linkedin-search.json",
    "inputSha256": "f5c2379ac95edd74fbc76f236cc23bb2cc02c998cdf69f76a2e6643fe4a767f0",
    "maxItems": 5,
    "maxTotalChargeUsd": 0.1,
    "maxFollowUpRuns": 0,
    "checks": [
      "terminal_succeeded",
      "resolved_build_identity",
      "same_run_storages",
      "summary_schema",
      "summary_status",
      "dataset_count",
      "row_schema",
      "row_source",
      "retry_policy",
      "settled_cost"
    ],
    "sideEffects": [
      "One paid Actor run and retained Apify run, dataset, key-value-store, and accounting records.",
      "No destination, schedule, webhook, publication, or metadata change."
    ],
    "rollback": "Do not retry or publish the result. Preserve the failed receipt for diagnosis; no Actor selector or metadata is changed by this proposal."
  }
}
